Image,Types,Title,Description,Tags,Fields,Time,Json Response
image_E427A428-7C0B-4612-95BD-C252F823483D.jpg,"Stationary, Pen",Cross Classic Century 10K Gold Pen,"The Cross Classic Century 10K Gold Filled/Rolled Gold Ballpoint Pen is an iconic writing instrument known for its slim silhouette and sophisticated design. It features a 10-karat gold filled/rolled gold finish, a patented propel-repel ball pen mechanism, and a trademark conical tip. The pen comes with a lifetime mechanical guarantee.","Stationary, Pen, Ballpoint Pen, Cross, Classic Century, Gold Pen","Brand (TEXT): Cross, Model (TEXT): Classic Century, Material (TEXT): 10K Gold Filled/Rolled Gold, Pen Type (TEXT): Ballpoint Pen, Refill (TEXT): Cross 8513 Black Medium Ball-Point Refill",6.07,"{""Data"": {""title"": ""Cross Classic Century 10K Gold Pen"", ""description"": ""The Cross Classic Century 10K Gold Filled/Rolled Gold Ballpoint Pen is an iconic writing instrument known for its slim silhouette and sophisticated design. It features a 10-karat gold filled/rolled gold finish, a patented propel-repel ball pen mechanism, and a trademark conical tip. The pen comes with a lifetime mechanical guarantee."", ""tags"": [""Stationary"", ""Pen"", ""Ballpoint Pen"", ""Cross"", ""Classic Century"", ""Gold Pen""], ""fields"": [{""field_name"": ""Brand"", ""field_type"": ""TEXT"", ""field_value"": ""Cross""}, {""field_name"": ""Model"", ""field_type"": ""TEXT"", ""field_value"": ""Classic Century""}, {""field_name"": ""Material"", ""field_type"": ""TEXT"", ""field_value"": ""10K Gold Filled/Rolled Gold""}, {""field_name"": ""Pen Type"", ""field_type"": ""TEXT"", ""field_value"": ""Ballpoint Pen""}, {""field_name"": ""Refill"", ""field_type"": ""TEXT"", ""field_value"": ""Cross 8513 Black Medium Ball-Point Refill""}]}}"
image_F44733FD-D4E8-4962-8DA1-9B526B78453F.jpg,"Electronics, SD Card",Thinkware Dash Cam 32GB MicroSD Card,"The Thinkware MicroSD card is designed for Thinkware dash cams, ensuring reliable recording and storage. It features Class 10 speed and 32GB capacity. Thinkware SD cards utilize SPOR (Sudden Power Off Recovery) technology to ensure reliability of the data stored.","Electronics, SD Card, MicroSD, Thinkware, Dash Cam, 32GB","Brand (TEXT): Thinkware, Capacity (NUMBER): 32 GB, Model Number (TEXT): LST3DV451, Compatible Devices (TEXT): Thinkware Dash Cams, SD Speed Class (TEXT): Class 10",7.09,"{""Data"": {""title"": ""Thinkware Dash Cam 32GB MicroSD Card"", ""description"": ""The Thinkware MicroSD card is designed for Thinkware dash cams, ensuring reliable recording and storage. It features Class 10 speed and 32GB capacity. Thinkware SD cards utilize SPOR (Sudden Power Off Recovery) technology to ensure reliability of the data stored."", ""tags"": [""Electronics"", ""SD Card"", ""MicroSD"", ""Thinkware"", ""Dash Cam"", ""32GB""], ""fields"": [{""field_name"": ""Brand"", ""field_type"": ""TEXT"", ""field_value"": ""Thinkware""}, {""field_name"": ""Capacity"", ""field_type"": ""NUMBER"", ""field_value"": ""32 GB""}, {""field_name"": ""Model Number"", ""field_type"": ""TEXT"", ""field_value"": ""LST3DV451""}, {""field_name"": ""Compatible Devices"", ""field_type"": ""TEXT"", ""field_value"": ""Thinkware Dash Cams""}, {""field_name"": ""SD Speed Class"", ""field_type"": ""TEXT"", ""field_value"": ""Class 10""}]}}"
image_F090A8E4-E3BF-45A9-B3C7-843304DE2D22.jpg,"Security, Padlock",Godrej Nav-Tal 7 Levers Padlock,"The Godrej Nav-Tal 7 Levers Padlock is a security device featuring a 7-lever locking mechanism for enhanced protection. It is constructed from durable brass and comes with a set of keys. Suitable for both indoor and outdoor use, providing a reliable security solution for homes and shops.","Security, Padlock, Godrej, Nav-Tal, 7 Levers","Brand (TEXT): Godrej, Model (TEXT): Nav-Tal 7 Levers, Type (TEXT): Padlock, Number of Levers (NUMBER): 7, Material (TEXT): Brass",6.07,"{""Data"": {""title"": ""Godrej Nav-Tal 7 Levers Padlock"", ""description"": ""The Godrej Nav-Tal 7 Levers Padlock is a security device featuring a 7-lever locking mechanism for enhanced protection. It is constructed from durable brass and comes with a set of keys. Suitable for both indoor and outdoor use, providing a reliable security solution for homes and shops."", ""tags"": [""Security"", ""Padlock"", ""Godrej"", ""Nav-Tal"", ""7 Levers""], ""fields"": [{""field_name"": ""Brand"", ""field_type"": ""TEXT"", ""field_value"": ""Godrej""}, {""field_name"": ""Model"", ""field_type"": ""TEXT"", ""field_value"": ""Nav-Tal 7 Levers""}, {""field_name"": ""Type"", ""field_type"": ""TEXT"", ""field_value"": ""Padlock""}, {""field_name"": ""Number of Levers"", ""field_type"": ""NUMBER"", ""field_value"": ""7""}, {""field_name"": ""Material"", ""field_type"": ""TEXT"", ""field_value"": ""Brass""}]}}"
image_A136642F-D632-4660-AF74-FC797BC4FD46.jpg,"Footwear, Shoes",Woven Slip-On Shoes,"Features a pair of brown woven slip-on shoes with a light-colored sole. The shoes have a casual style, suitable for everyday wear. The woven texture adds a unique touch to the design.","Footwear, Shoes, Slip-on shoes, Woven shoes, Casual shoes","Shoe Type (TEXT): Slip-on, Upper Material (TEXT): Woven, Style (TEXT): Casual",5.45,"{""Data"": {""title"": ""Woven Slip-On Shoes"", ""description"": ""Features a pair of brown woven slip-on shoes with a light-colored sole. The shoes have a casual style, suitable for everyday wear. The woven texture adds a unique touch to the design."", ""tags"": [""Footwear"", ""Shoes"", ""Slip-on shoes"", ""Woven shoes"", ""Casual shoes""], ""fields"": [{""field_name"": ""Shoe Type"", ""field_type"": ""TEXT"", ""field_value"": ""Slip-on""}, {""field_name"": ""Upper Material"", ""field_type"": ""TEXT"", ""field_value"": ""Woven""}, {""field_name"": ""Style"", ""field_type"": ""TEXT"", ""field_value"": ""Casual""}]}}"
image_DDBA3B38-37F3-4B0D-A359-4D3CECA1D42B.jpg,"Kitchen, Gas lighter",Wonderchef Gas Lighter,"Wonderchef gas lighter made of stainless steel, designed for durability and ease of use. It features a soft, long grip handle and requires no external liquids or batteries for ignition. The lighter is rustproof and unbreakable, providing a convenient and reliable way to ignite gas stoves with a single click.","Kitchen, Gas Lighter, Wonderchef, Stainless Steel, Igniter","Brand (TEXT): Wonderchef, Material (TEXT): Stainless Steel, Type (TEXT): Gas Lighter, Warranty (TEXT): 1 Year",5.45,"{""Data"": {""title"": ""Wonderchef Gas Lighter"", ""description"": ""Wonderchef gas lighter made of stainless steel, designed for durability and ease of use. It features a soft, long grip handle and requires no external liquids or batteries for ignition. The lighter is rustproof and unbreakable, providing a convenient and reliable way to ignite gas stoves with a single click."", ""tags"": [""Kitchen"", ""Gas Lighter"", ""Wonderchef"", ""Stainless Steel"", ""Igniter""], ""fields"": [{""field_name"": ""Brand"", ""field_type"": ""TEXT"", ""field_value"": ""Wonderchef""}, {""field_name"": ""Material"", ""field_type"": ""TEXT"", ""field_value"": ""Stainless Steel""}, {""field_name"": ""Type"", ""field_type"": ""TEXT"", ""field_value"": ""Gas Lighter""}, {""field_name"": ""Warranty"", ""field_type"": ""TEXT"", ""field_value"": ""1 Year""}]}}"
SUMMARY,Total Images: 5,Successfully Processed: 5,Failed: 0,Total: 30.13s,Average: 6.03s,,
